ID,Name,PackageManager,Platform,Description,HomepageURL,SourceCodeURL,Maintainer,License,Author
315,ghc-filesystem,Conan,C/C++,A header-only single-file std::filesystem compatible helper library,https://github.com/conan-io/conan-center-index,,,MIT,
316,giflib,Conan,C/C++,A library and utilities for reading and writing GIF images.,https://github.com/conan-io/conan-center-index,,,MIT,
317,ginkgo,Conan,C/C++,"High-performance linear algebra library for manycore systems, with a focus on sparse solution of linear systems.",https://github.com/conan-io/conan-center-index,,,BSD-3-Clause,
318,glad,Conan,C/C++,Multi-Language GL/GLES/EGL/GLX/WGL Loader-Generator based on the official specs.,https://github.com/conan-io/conan-center-index,,,MIT,
319,glbinding,Conan,C/C++,"A C++ binding for the OpenGL API, generated using the gl.xml specification.",https://github.com/conan-io/conan-center-index,,,MIT,
320,glew,Conan,C/C++,The GLEW library,https://github.com/conan-io/conan-center-index,,,MIT,
322,glfw,Conan,C/C++,"GLFW is a free, Open Source, multi-platform library for OpenGL, OpenGL ES and Vulkanapplication development. It provides a simple, platform-independent API for creatingwindows, contexts and surfaces, reading input, handling events, etc.",https://github.com/conan-io/conan-center-index,,,Zlib,
323,glib,Conan,C/C++,GLib provides the core application building blocks for libraries and applications written in C,https://github.com/conan-io/conan-center-index,,,LGPL-2.1,
324,glm,Conan,C/C++,OpenGL Mathematics (GLM),https://github.com/conan-io/conan-center-index,,,MIT,
325,glog,Conan,C/C++,Google logging library,https://github.com/conan-io/conan-center-index,,,BSD-3-Clause,
326,glslang,Conan,C/C++,"Khronos-reference front end for GLSL/ESSL, partial front end for HLSL, and a SPIR-V generator.",https://github.com/conan-io/conan-center-index,,,BSD-3-Clause,
327,glu,Conan,C/C++,cross-platform virtual conan package for the GLU support,https://github.com/conan-io/conan-center-index,,,SGI-B-2.0,
328,gm2calc,Conan,C/C++,C++ library to calculate the anomalous magnetic moment of the muon in the MSSM,https://github.com/conan-io/conan-center-index,,,GPL-3.0,
329,gmp,Conan,C/C++,"GMP is a free library for arbitrary precision arithmetic, operating on signed integers, rational numbers, and floating-point numbers.",https://github.com/conan-io/conan-center-index,,,LGPL-3.0,
330,gn,Conan,C/C++,GN is a meta-build system that generates build files for Ninja.,https://github.com/conan-io/conan-center-index,,,BSD-3-Clause,
331,gnu-config,Conan,C/C++,The GNU config.guess and config.sub scripts,https://github.com/conan-io/conan-center-index,,,GPL-3.0-or-later,
332,gnulib,Conan,C/C++,"Gnulib is a central location for common GNU code, intended to be shared among GNU packages.",https://github.com/conan-io/conan-center-index,,,GPL-3.0-or-later,
333,gobject-introspection,Conan,C/C++,GObject introspection is a middleware layer between C libraries (using GObject) and language bindings,https://github.com/conan-io/conan-center-index,,,LGPL-2.1,
334,godot-cpp,Conan,C/C++,C++ bindings for the Godot script API,https://github.com/conan-io/conan-center-index,,,MIT,
335,godot_headers,Conan,C/C++,Godot Native interface headers,https://github.com/conan-io/conan-center-index,,,MIT,
336,google-cloud-cpp,Conan,C/C++,C++ Client Libraries for Google Cloud Services,https://github.com/conan-io/conan-center-index,,,Apache-2.0,
337,gperf,Conan,C/C++,GNU gperf is a perfect hash function generator,https://github.com/conan-io/conan-center-index,,,GPL-3.0-or-later,
338,graphene,Conan,C/C++,A thin layer of graphic data types.,https://github.com/conan-io/conan-center-index,,,MIT,
339,graphthewy,Conan,C/C++,Simple header-only C++ Library for graph modelling (directed or not) and graph cycle detection. ,https://github.com/conan-io/conan-center-index,,,EUPL-1.2,
340,greatest,Conan,C/C++,"A C testing library in 1 file. No dependencies, no dynamic allocation.",https://github.com/conan-io/conan-center-index,,,ISC,
341,grpc,Conan,C/C++,Google's RPC (remote procedure call) library and framework.,https://github.com/conan-io/conan-center-index,,,Apache-2.0,
342,gsl,Conan,C/C++,GNU Scientific Library,https://github.com/conan-io/conan-center-index,,,GPL-3.0-or-later,
343,gsl-lite,Conan,C/C++,"A single-file header-only version of ISO C++ Guideline Support Library (GSL) for C++98, C++11 and later",https://github.com/conan-io/conan-center-index,,,MIT,
345,gst-plugins-base,Conan,C/C++,"GStreamer is a development framework for creating applications like media players, video editors, streaming media broadcasters and so on",https://github.com/conan-io/conan-center-index,,,GPL-2.0-only,
346,gstreamer,Conan,C/C++,"GStreamer is a development framework for creating applications like media players, video editors, streaming media broadcasters and so on",https://github.com/conan-io/conan-center-index,,,GPL-2.0-only,
347,gtest,Conan,C/C++,Google's C++ test framework,https://github.com/conan-io/conan-center-index,,,BSD-3-Clause,
348,gtk,Conan,C/C++,libraries used for creating graphical user interfaces for applications.,https://github.com/conan-io/conan-center-index,,,LGPL-2.1-or-later,
349,gtk-doc-stub,Conan,C/C++,Helper scripts for generating GTK documentation,https://github.com/conan-io/conan-center-index,,,GPL-2.0-or-later,
350,gtsam,Conan,C/C++,GTSAM is a library of C++ classes that implement                    smoothing and mapping (SAM) in robotics and vision,https://github.com/conan-io/conan-center-index,,,BSD-3-Clause,
351,guetzli,Conan,C/C++,Perceptual JPEG encoder,https://github.com/conan-io/conan-center-index,,,Apache-2.0,
352,gumbo-parser,Conan,C/C++,An HTML5 parsing library in pure C99,https://github.com/conan-io/conan-center-index,,,Apache-2.0,
353,h3,Conan,C/C++,Hexagonal hierarchical geospatial indexing system.,https://github.com/conan-io/conan-center-index,,,Apache-2.0,
354,h5pp,Conan,C/C++,A C++17 wrapper for HDF5 with focus on simplicity,https://github.com/conan-io/conan-center-index,,,MIT,
355,half,Conan,C/C++,"C++ header-only library to provide an IEEE 754 conformant 16-bit half-precision floating-point type along with corresponding arithmetic operators, type conversions and common mathematical functions.",https://github.com/conan-io/conan-center-index,,,MIT,
356,hana,Conan,C/C++,Hana is a header-only library for C++ metaprogramming suited for computations on both types and values.,https://github.com/conan-io/conan-center-index,,,BSL-1.0,
357,happly,Conan,C/C++,A C++ header-only parser for the PLY file format. Parse .ply happily!,https://github.com/conan-io/conan-center-index,,,MIT,
358,harfbuzz,Conan,C/C++,HarfBuzz is an OpenType text shaping engine.,https://github.com/conan-io/conan-center-index,,,MIT,
359,hazelcast-cpp-client,Conan,C/C++,C++ client library for Hazelcast in-memory database.,https://github.com/conan-io/conan-center-index,,,Apache-2.0,
360,hdf4,Conan,C/C++,"HDF4 is a data model, library, and file format for storing and managing data.",https://github.com/conan-io/conan-center-index,,,BSD-3-Clause,
361,hdf5,Conan,C/C++,"HDF5 is a data model, library, and file format for storing and managing data.",https://github.com/conan-io/conan-center-index,,,BSD-3-Clause,
362,hdrhistogram-c,Conan,C/C++,'C' port of High Dynamic Range (HDR) Histogram,https://github.com/conan-io/conan-center-index,,,BSD-2-Clause,
363,hedley,Conan,C/C++,A C/C++ header to help move #ifdefs out of your code,https://github.com/conan-io/conan-center-index,,,CC0-1.0,
364,hidapi,Conan,C/C++,"HIDAPI is a multi-platform library which allows an application to interface with USB and Bluetooth HID-Class devices on Windows, Linux, FreeBSD, and macOS.",https://github.com/conan-io/conan-center-index,,,GPL-3-or-later,
366,highway,Conan,C/C++,"Performance-portable, length-agnostic SIMD with runtime dispatch",https://github.com/conan-io/conan-center-index,,,Apache-2.0,
367,hipony-enumerate,Conan,C/C++,C++11 compatible version of enumerate,https://github.com/conan-io/conan-center-index,,,BSL-1.0,
368,hippomocks,Conan,C/C++,Single-header mocking framework.,https://github.com/conan-io/conan-center-index,,,LGPL-2.1,
369,hiredis,Conan,C/C++,Minimalistic C client for Redis >= 1.2,https://github.com/conan-io/conan-center-index,,,BSD-3-Clause,
370,hlslpp,Conan,C/C++,Header-only Math library using hlsl syntax with SSE/NEON support,https://github.com/conan-io/conan-center-index,,,MIT,
371,http_parser,Conan,C/C++,http request/response parser for c ,https://github.com/conan-io/conan-center-index,,,MIT,
372,huffman,Conan,C/C++,huffman encoder/decoder,https://github.com/conan-io/conan-center-index,,,Unlicense,
373,hyperscan,Conan,C/C++,High-performance regular expression matching library,https://github.com/conan-io/conan-center-index,,,BSD-3-Clause,
374,icecream-cpp,Conan,C/C++,A little library to help with the print debugging on C++11 and forward.,https://github.com/conan-io/conan-center-index,,,MIT,
375,iceoryx,Conan,C/C++,Eclipse iceoryx - true zero-copy inter-process-communication,https://github.com/conan-io/conan-center-index,,,Apache-2.0,
376,icu,Conan,C/C++,"ICU is a mature, widely used set of C/C++ and Java libraries providing Unicode and Globalization support for software applications.",https://github.com/conan-io/conan-center-index,,,ICU,
377,ignition-cmake,Conan,C/C++,A set of CMake modules that are used by the C++-based Ignition projects.,https://github.com/conan-io/conan-center-index,,,Apache-2.0,
378,ignition-math,Conan,C/C++," Math classes and functions for robot applications",https://github.com/conan-io/conan-center-index,,,Apache-2.0,
379,imagemagick,Conan,C/C++,"ImageMagick is a free and open-source software suite for displaying, converting, and editing raster image and vector image files",https://github.com/conan-io/conan-center-index,,,ImageMagick,
380,imagl,Conan,C/C++,A lightweight library to load image for OpenGL application.,https://github.com/conan-io/conan-center-index,,,GPL-3.0-or-later,
381,imake,Conan,C/C++,Obsolete C preprocessor interface to the make utility,https://github.com/conan-io/conan-center-index,,,MIT,
382,imgui,Conan,C/C++,Bloat-free Immediate Mode Graphical User interface for C++ with minimal dependencies,https://github.com/conan-io/conan-center-index,,,MIT,
383,imguizmo,Conan,C/C++,Immediate mode 3D gizmo for scene editing and other controls based on Dear Imgui,https://github.com/conan-io/conan-center-index,,,MIT,
384,immer,Conan,C/C++,Postmodern immutable and persistent data structures for C++---value semantics at scale,https://github.com/conan-io/conan-center-index,,,BSL-1.0,
385,implot,Conan,C/C++,Advanced 2D Plotting for Dear ImGui,https://github.com/conan-io/conan-center-index,,,MIT,
386,indicators,Conan,C/C++,Activity Indicators for Modern C++,https://github.com/conan-io/conan-center-index,,,MIT,
387,influxdb-cpp,Conan,C/C++,C++ client for InfluxDB.,https://github.com/conan-io/conan-center-index,,,MIT,
388,inih,Conan,C/C++,"Simple .INI file parser in C, good for embedded systems ",https://github.com/conan-io/conan-center-index,,,BSD-3-Clause,
389,inja,Conan,C/C++,"Inja is a template engine for modern C++, loosely inspired by jinja for python",https://github.com/conan-io/conan-center-index,,,MIT,
390,intel-neon2sse,Conan,C/C++,Header only library intended to simplify ARM->IA32 porting,https://github.com/conan-io/conan-center-index,,,BSD-2-Clause,
392,iqa,Conan,C/C++,Image Quality Analysis Library,https://github.com/conan-io/conan-center-index,,,BSD-3-Clause,
393,irrxml,Conan,C/C++,irrXML is a simple and fast open source xml parser for C++,https://github.com/conan-io/conan-center-index,,,ZLIB,
394,isl,Conan,C/C++,isl is a library for manipulating sets and relations of integer points bounded by linear constraints.,https://github.com/conan-io/conan-center-index,,,MIT,
395,itk,Conan,C/C++,Insight Segmentation and Registration Toolkit,https://github.com/conan-io/conan-center-index,,,Apache-2.0,
396,itlib,Conan,C/C++,A collection of small single-header C++ libraries similar to or extending the C++ standard library.,https://github.com/conan-io/conan-center-index,,,MIT,
397,ixwebsocket,Conan,C/C++,IXWebSocket is a C++ library for WebSocket client and server development,https://github.com/conan-io/conan-center-index,,,BSD-3-Clause,
398,jansson,Conan,C/C++,"C library for encoding, decoding and manipulating JSON data",https://github.com/conan-io/conan-center-index,,,MIT,
399,jasper,Conan,C/C++,JasPer Image Processing/Coding Tool Kit,https://github.com/conan-io/conan-center-index,,,JasPer License Version 2.0,
400,jbig,Conan,C/C++,jbig for the Windows build of ImageMagick,https://github.com/conan-io/conan-center-index,,,GPL-2.0,
401,jemalloc,Conan,C/C++,jemalloc is a general purpose malloc(3) implementation that emphasizes fragmentation avoidance and scalable concurrency support.,https://github.com/conan-io/conan-center-index,,,BSD-2-Clause,
402,jerryscript,Conan,C/C++,Ultra-lightweight JavaScript engine for the Internet of Things,https://github.com/conan-io/conan-center-index,,,Apache-2.0,
403,jfalcou-eve,Conan,C/C++,Expressive Velocity Engine - reimplementation of the old Boost.SIMD on C++20,https://github.com/conan-io/conan-center-index,,,MIT,
404,jinja2cpp,Conan,C/C++,Jinja2 C++ (and for C++) almost full-conformance template engine implementation,https://github.com/conan-io/conan-center-index,,,MIT,
406,jpcre2,Conan,C/C++,Header-only C++ wrapper for PCRE2 library.,https://github.com/conan-io/conan-center-index,,,BSD-3-Clause,
407,jpeg-compressor,Conan,C/C++,C++ JPEG compression/fuzzed low-RAM JPEG decompression codec with Public Domain or Apache 2.0 license,https://github.com/conan-io/conan-center-index,,,Unlicense,
408,json-c,Conan,C/C++,JSON-C - A JSON implementation in C,https://github.com/conan-io/conan-center-index,,,MIT,
409,json-schema-validator,Conan,C/C++,JSON schema validator for JSON for Modern C++ ,https://github.com/conan-io/conan-center-index,,,MIT,
410,json_dto,Conan,C/C++,A small header-only helper for converting data between json representation and c++ structs,https://github.com/conan-io/conan-center-index,,,BSD-3-Clause,
411,jsoncpp,Conan,C/C++,A C++ library for interacting with JSON.,https://github.com/conan-io/conan-center-index,,,MIT,
412,jsonformoderncpp,Conan,C/C++,JSON for Modern C++ parser and generator.,https://github.com/conan-io/conan-center-index,,,MIT,
413,jsonnet,Conan,C/C++,Jsonnet - The data templating language,https://github.com/conan-io/conan-center-index,,,Apache-2.0,
414,jthread-lite,Conan,C/C++,jthread lite - C++20's jthread for C++11 and later in a single-file header-only library ,https://github.com/conan-io/conan-center-index,,,BSL-1.0,
415,jwasm,Conan,C/C++,JWasm is intended to be a free Masm-compatible assembler.,https://github.com/conan-io/conan-center-index,,,Watcom-1.0,
416,jwt-cpp,Conan,C/C++,A C++ JSON Web Token library for encoding/decoding,https://github.com/conan-io/conan-center-index,,,MIT,
417,jxrlib,Conan,C/C++,jxrlib is JPEG XR Image Codec reference implementation library released by Microsoft under BSD-2-Clause License.,https://github.com/conan-io/conan-center-index,,,BSD-2-Clause,
418,kainjow-mustache,Conan,C/C++,Mustache text templates for modern C++,https://github.com/conan-io/conan-center-index,,,BSL-1.0,
419,kaitai_struct_cpp_stl_runtime,Conan,C/C++,kaitai struct c++ runtime library,https://github.com/conan-io/conan-center-index,,,MIT,
420,kangaru,Conan,C/C++,"A dependency injection container for C++11, C++14 and later",https://github.com/conan-io/conan-center-index,,,MIT,
421,kcov,Conan,C/C++,"Code coverage tool for compiled programs, Python and Bash        which uses debugging information to collect and report data without            special compilation options",https://github.com/conan-io/conan-center-index/,,,GPL-2.0,
422,kcp,Conan,C/C++,A Fast and Reliable ARQ Protocol,https://github.com/conan-io/conan-center-index,,,MIT,
423,kealib,Conan,C/C++,C++ library providing complete access to the KEA image format.,https://github.com/conan-io/conan-center-index,,,MIT,
424,keychain,Conan,C/C++,A cross-platform wrapper for the operating system's credential storage,https://github.com/conan-io/conan-center-index,,,MIT,
426,kissfft,Conan,C/C++,"a Fast Fourier Transform (FFT) library that tries to Keep it Simple, Stupid",https://github.com/conan-io/conan-center-index,,,BSD-3-Clause,
427,kitten,Conan,C/C++,A small C++ library inspired by Category Theory focused on functional composition.,https://github.com/conan-io/conan-center-index,,,MIT,
428,ktx,Conan,C/C++,Khronos Texture library and tool.,https://github.com/conan-io/conan-center-index,,,Apache-2.0,
429,kuba-zip,Conan,C/C++,"A portable, simple zip library written in C",https://github.com/conan-io/conan-center-index,,,Unlicense,
430,laszip,Conan,C/C++,C++ library for lossless LiDAR compression.,https://github.com/conan-io/conan-center-index,,,LGPL-2.1,
431,lcms,Conan,C/C++,"A free, open source, CMM engine.",https://github.com/conan-io/conan-center-index,,,MIT,
432,lemon,Conan,C/C++,The Lemon program reads a grammar of the input language and emits C-code to implement a parser for that language.,https://github.com/conan-io/conan-center-index,,,Unlicense,
433,leptonica,Conan,C/C++,Library containing software that is broadly useful for image processing and image analysis applications.,https://github.com/conan-io/conan-center-index,,,BSD 2-Clause,
434,lerc,Conan,C/C++,C++ library for limited Error Raster Compression.,https://github.com/conan-io/conan-center-index,,,Apache-2.0,
435,lest,Conan,C/C++,"A modern, C++11-native, single-file header-only, tiny framework for unit-tests, TDD and BDD.",https://github.com/conan-io/conan-center-index,,,BSL-1.0,
436,leveldb,Conan,C/C++,LevelDB is a fast key-value storage library written at Google that provides an ordered mapping from string keys to string values.,https://github.com/conan-io/conan-center-index,,,BSD-3-Clause,
437,libaec,Conan,C/C++,Adaptive Entropy Coding library,https://github.com/conan-io/conan-center-index,,,BSD-2-Clause,
438,libalsa,Conan,C/C++,"Library of ALSA: The Advanced Linux Sound Architecture, that provides audio and MIDI functionality to the Linux operating system",https://github.com/conan-io/conan-center-index,,,LGPL-2.1,
439,libaom-av1,Conan,C/C++,AV1 Codec Library,https://github.com/conan-io/conan-center-index,,,BSD-2-Clause,
440,libarchive,Conan,C/C++,Multi-format archive and compression library,https://github.com/conan-io/conan-center-index,,,BSD-2-Clause,
441,libatomic_ops,Conan,C/C++,The atomic_ops project (Atomic memory update operations portable implementation),https://github.com/conan-io/conan-center-index,,,GPL-2.0-or-later,
442,libattr,Conan,C/C++,Commands for Manipulating Filesystem Extended Attributes,https://github.com/conan-io/conan-center-index,,,GPL-2.0-or-later,
443,libavrocpp,Conan,C/C++,Avro is a data serialization system.,https://github.com/conan-io/conan-center-index,,,Apache-2.0,
444,libb2,Conan,C/C++,"libb2 is a library that implemets the BLAKE2 cryptographic hash function, which is faster than MD5,                     SHA-1, SHA-2, and SHA-3, yet is at least as secure as the latest standard SHA-3",https://github.com/conan-io/conan-center-index,,,CC0-1.0,
445,libbacktrace,Conan,C/C++,A C library that may be linked into a C/C++ program to produce symbolic backtraces.,https://github.com/conan-io/conan-center-index,,,BSD-3-Clause,
446,libbasisu,Conan,C/C++,Basis Universal Supercompressed GPU Texture Codec,https://github.com/conan-io/conan-center-index,,,Apache-2.0,
447,libbpf,Conan,C/C++,eBPF helper library,https://github.com/conan-io/conan-center-index,,,LGPL-2.1,
448,libbsd,Conan,C/C++,"This library provides useful functions commonly found on BSD systems, and lacking on others like GNU systems, thus making it easier to port projects with strong BSD origins, without needing to embed the same code over and over again on each project.",https://github.com/conan-io/conan-center-index,,,ISC,
449,libcap,Conan,C/C++,This is a library for getting and setting POSIX.1e (formerly POSIX 6) draft 15 capabilities,https://github.com/conan-io/conan-center-index,,,GPL-2.0-only,
450,libcbor,Conan,C/C++,CBOR protocol implementation for C,https://github.com/conan-io/conan-center-index,,,MIT,
451,libccd,Conan,C/C++,Library for collision detection between two convex shapes.,https://github.com/conan-io/conan-center-index,,,BSD-3-Clause,
452,libcds,Conan,C/C++,C++11 library of Concurrent Data Structures.,https://github.com/conan-io/conan-center-index,,,BSL-1.0,
453,libcheck,Conan,C/C++,A unit testing framework for C,https://github.com/conan-io/conan-center-index,,,https://github.com/libcheck/check,
454,libcoap,Conan,C/C++,A CoAP (RFC 7252) implementation in C,https://github.com/conan-io/conan-center-index,,,BSD-2-Clause,
455,libconfig,Conan,C/C++,C/C++ library for processing configuration files,https://github.com/conan-io/conan-center-index,,,LGPL-2.1,
456,libconfuse,Conan,C/C++,Small configuration file parser library for C,https://github.com/conan-io/conan-center-index,,,ISC,
457,libcorrect,Conan,C/C++,C library for Convolutional codes and Reed-Solomon,https://github.com/conan-io/conan-center-index,,,BSD-3-Clause,
458,libcpuid,Conan,C/C++,libcpuid  is a small C library for x86 CPU detection and feature extraction,https://github.com/conan-io/conan-center-index,,,https://github.com/anrieff/libcpuid,
459,libcurl,Conan,C/C++,command line tool and library for transferring data with URLs,https://github.com/conan-io/conan-center-index,,,MIT,
460,libdaemon,Conan,C/C++,a lightweight C library that eases the writing of UNIX daemons,https://github.com/conan-io/conan-center-index,,,LGPL-2.1-or-later,
461,libdb,Conan,C/C++,Berkeley DB is a family of embedded key-value database libraries providing scalable high-performance data management services to applications,https://github.com/conan-io/conan-center-index,,,BSD-3-Clause,
462,libdc1394,Conan,C/C++,libdc1394 provides a complete high level API to control IEEE 1394 based cameras,https://github.com/conan-io/conan-center-index,,,LGPL-2.1-or-later,
463,libde265,Conan,C/C++,Open h.265 video codec implementation.,https://github.com/conan-io/conan-center-index,,,LGPL-3.0-or-later,
464,libdeflate,Conan,C/C++,Heavily optimized library for DEFLATE/zlib/gzip compression and decompression.,https://github.com/conan-io/conan-center-index,,,MIT,
465,libdisasm,Conan,C/C++,The libdisasm library provides basic disassembly of Intel x86 instructions from a binary stream.,https://github.com/conan-io/conan-center-index,,,MIT,
466,libdispatch,Conan,C/C++,Grand Central Dispatch (GCD or libdispatch) provides comprehensive support for concurrent code execution on multicore hardware.,https://github.com/conan-io/conan-center-index,,,Apache-2.0,
467,libdivide,Conan,C/C++,Header-only C/C++ library for optimizing integer division.,https://github.com/conan-io/conan-center-index,,,Zlib,
468,libdwarf,Conan,C/C++,A library and a set of command-line tools for reading and writing DWARF2,https://github.com/conan-io/conan-center-index,,,LGPL-2.1,
469,libdxfrw,Conan,C/C++,C++ library to read/write DXF and read DWG files,https://github.com/conan-io/conan-center-index,,,GPL-2.0-or-later,
470,libe57format,Conan,C/C++,Library for reading & writing the E57 file format,https://github.com/conan-io/conan-center-index,,,BSL-1.0,
471,libelf,Conan,C/C++,ELF object file access library,https://github.com/conan-io/conan-center-index,,,LGPL-2.0,
472,libelfin,Conan,C/C++,C++11 library for reading ELF binaries and DWARFv4 debug information,https://github.com/conan-io/conan-center-index,,,MIT,
473,libepoxy,Conan,C/C++,libepoxy is a library for handling OpenGL function pointer management,https://github.com/conan-io/conan-center-index,,,MIT,
474,libest,Conan,C/C++,EST is used for secure certificate enrollment,https://github.com/conan-io/conan-center-index,,,BSD-3-Clause,
475,libev,Conan,C/C++,A full-featured and high-performance event loop that is loosely modelled after libevent,https://github.com/conan-io/conan-center-index,,,BSD-2-Clause,
476,libevent,Conan,C/C++,libevent - an event notification library,https://github.com/conan-io/conan-center-index,,,BSD-3-Clause,
477,libexif,Conan,C/C++,"libexif is a library for parsing, editing, and saving EXIF data.",https://github.com/conan-io/conan-center-index,,,LGPL-2.1,
478,libfabric,Conan,C/C++,Open Fabric Interfaces,https://github.com/conan-io/conan-center-index,,,BSD-2-Clause,
479,libfdk_aac,Conan,C/C++,A standalone library of the Fraunhofer FDK AAC code from Android,https://github.com/conan-io/conan-center-index,,,https://github.com/mstorsjo/fdk-aac/blob/master/NOTICE,
480,libffi,Conan,C/C++,"A portable, high level programming interface to various calling conventions",https://github.com/conan-io/conan-center-index,,,MIT,
483,libftdi,Conan,C/C++,A library to talk to FTDI chips,https://github.com/conan-io/conan-center-index,,,LGPL-2.0-only,
485,libgcrypt,Conan,C/C++,Libgcrypt is a general purpose cryptographic library originally based on code from GnuPG,https://github.com/conan-io/conan-center-index,,,LGPL-2.1-or-later,
486,libgd,Conan,C/C++,GD is an open source code library for the dynamic creation of images by programmers.,https://github.com/conan-io/conan-center-index,,,BSD-like,
487,libgeotiff,Conan,C/C++,"Libgeotiff is an open source library normally hosted on top of libtiff for reading, and writing GeoTIFF information tags.",https://github.com/conan-io/conan-center-index,,,MIT,
488,libgettext,Conan,C/C++,An internationalization and localization system for multilingual programs,https://github.com/conan-io/conan-center-index,,,GPL-3.0-or-later,
489,libgit2,Conan,C/C++,"libgit2 is a portable, pure C implementation of the Git core methods provided as a re-entrant linkable library with a solid API",https://github.com/conan-io/conan-center-index,,,GPL-2.0-linking-exception,
