ID,Name,PackageManager,Platform,Description,HomepageURL,SourceCodeURL,Maintainer,License,Author
490,libgpg-error,Conan,C/C++,Libgpg-error is a small library that originally defined common error values for all GnuPG components.,https://github.com/conan-io/conan-center-index,,,GPL-2.0-or-later,
492,libgpiod,Conan,C/C++,C library and tools for interacting with the linux GPIO character device,https://github.com/conan-io/conan-center-index,,,LGPL-2.1-or-later,
493,libgta,Conan,C/C++,Library that reads and writes GTA (Generic Tagged Arrays) files.,https://github.com/conan-io/conan-center-index,,,LGPL-2.1-or-later,
494,libharu,Conan,C/C++,"Haru is a free, cross platform, open-sourced software library for generating PDF.",https://github.com/conan-io/conan-center-index,,,ZLIB,
495,libheif,Conan,C/C++,libheif is an HEIF and AVIF file format decoder and encoder.,https://github.com/conan-io/conan-center-index,,,LGPL-3.0-only,
496,libiberty,Conan,C/C++,A collection of subroutines used by various GNU programs,https://github.com/conan-io/conan-center-index,,,LGPL-2.1,
497,libiconv,Conan,C/C++,Convert text to and from Unicode,https://github.com/conan-io/conan-center-index,,,LGPL-2.1,
498,libid3tag,Conan,C/C++,ID3 tag manipulation library.,https://github.com/conan-io/conan-center-index,,,GPL-2.0-or-later,
499,libidn,Conan,C/C++,"GNU Libidn is a fully documented implementation of the Stringprep, Punycode and IDNA 2003 specifications.",https://github.com/conan-io/conan-center-index,,,GPL-3.0-or-later,
500,libidn2,Conan,C/C++,"GNU Libidn is a fully documented implementation of the Stringprep, Punycode and IDNA 2003 specifications.",https://github.com/conan-io/conan-center-index,,,GPL-3.0-or-later,
501,libigl,Conan,C/C++,Simple C++ geometry processing library,https://github.com/conan-io/conan-center-index,,,MPL-2.0,
502,libjpeg,Conan,C/C++,Libjpeg is a widely used C library for reading and writing JPEG image files.,https://github.com/conan-io/conan-center-index,,,http://ijg.org/files/README,
503,libjpeg-turbo,Conan,C/C++,SIMD-accelerated libjpeg-compatible JPEG codec library,https://github.com/conan-io/conan-center-index,,,"BSD-3-Clause, Zlib",
504,libjxl,Conan,C/C++,JPEG XL image format reference implementation,https://github.com/conan-io/conan-center-index,,,BSD-3-Clause,
505,libkml,Conan,C/C++,Reference implementation of OGC KML 2.2,https://github.com/conan-io/conan-center-index,,,BSD-3-Clause,
506,libltc,Conan,C/C++,Linear/Logitudinal Time Code (LTC) Library,https://github.com/conan-io/conan-center-index,,,LGPL-3.0,
507,libmad,Conan,C/C++,MAD is a high-quality MPEG audio decoder.,https://github.com/conan-io/conan-center-index,,,GPL-2.0-or-later,
508,libmaxminddb,Conan,C/C++,C library for the MaxMind DB file format,https://github.com/conan-io/conan-center-index,,,Apache-2.0,
509,libmbus,Conan,C/C++,Meter-bus library and utility programs,https://github.com/conan-io/conan-center-index,,,BSD-3-Clause,
510,libmediainfo,Conan,C/C++,MediaInfo is a convenient unified display of the most relevant technical and tag data for video and audio files,https://github.com/conan-io/conan-center-index,,,BSD-2-Clause,
511,libmetalink,Conan,C/C++,Libmetalink is a library to read Metalink XML download description format. It supports both Metalink version 3 and Metalink version 4 (RFC 5854).,https://github.com/conan-io/conan-center-index,,,MIT,
512,libmikmod,Conan,C/C++,"Module player and library supporting many formats, including mod, s3m, it, and xm.",https://github.com/conan-io/conan-center-index,,,LGPL-2.1-or-later,
513,libmnl,Conan,C/C++,Minimalistic Netlink communication library,https://github.com/conan-io/conan-center-index,,,LGPL-2.1-or-later,
514,libmodbus,Conan,C/C++,libmodbus is a free software library to send/receive data according to the Modbus protocol,https://github.com/conan-io/conan-center-index,,,LGPL-2.1,
515,libmodplug,Conan,C/C++,libmodplug - the library which was part of the Modplug-xmms project,https://github.com/conan-io/conan-center-index,,,Unlicense,
516,libmorton,Conan,C/C++,"C++ header-only library with methods to efficiently encode/decode 64, 32 and 16-bit Morton codes and coordinates, in 2D and 3D.",https://github.com/conan-io/conan-center-index,,,MIT,
517,libmount,Conan,C/C++,"The libmount library is used to parse /etc/fstab, /etc/mtab and /proc/self/mountinfo files, manage the mtab file, evaluate mount options, etc",https://github.com/conan-io/conan-center-index,,,GPL-2.0-or-later,
518,libmp3lame,Conan,C/C++,LAME is a high quality MPEG Audio Layer III (MP3) encoder licensed under the LGPL.,https://github.com/conan-io/conan-center-index,,,LGPL-2.0,
519,libmysqlclient,Conan,C/C++,A MySQL client library for C development.,https://github.com/conan-io/conan-center-index,,,GPL-2.0,
520,libnet,Conan,C/C++,Libnet is an API to help with the construction and injection of network packets.,https://github.com/conan-io/conan-center-index,,,BSD-2-Clause,
521,libnetfilter_conntrack,Conan,C/C++,userspace library that provides an API to the in-kernel connection tracking state table,https://github.com/conan-io/conan-center-index,,,GPL-2.0-or-later,
522,libnetfilter_queue,Conan,C/C++,userspace library that provides an API to packets that have been queued by the kernel packet filter,https://github.com/conan-io/conan-center-index,,,GPL-2.0-or-later,
523,libnfnetlink,Conan,C/C++,low-level library for netfilter related kernel/userspace communication,https://github.com/conan-io/conan-center-index,,,GPL-2.0-or-later,
524,libnghttp2,Conan,C/C++,HTTP/2 C Library and tools,https://github.com/conan-io/conan-center-index,,,MIT,
525,libnl,Conan,C/C++,A collection of libraries providing APIs to netlink protocol based Linux kernel interfaces.,https://github.com/conan-io/conan-center-index,,,LGPL-2.1-only,
526,libnoise,Conan,C/C++,"A general-purpose library that generates three-dimensional coherent noise. Useful for terrain generation and procedural texture generation. Uses a broad number of techniques (Perlin noise, ridged multifractal, etc.) and combinations of those techniques.",https://github.com/conan-io/conan-center-index,,,LGPL-2.1-or-later,
527,libnop,Conan,C/C++,libnop is a header-only library for serializing and deserializing C++ data types without external code generators or runtime support libraries.,https://github.com/conan-io/conan-center-index,,,Apache-2.0,
528,libnova,Conan,C/C++,"libnova is a general purpose, double precision, celestial mechanics, astrometry and astrodynamics library.",https://github.com/conan-io/conan-center-index,,,LGPL-2.0-only,
529,libnuma,Conan,C/C++,NUMA support for Linux.,https://github.com/conan-io/conan-center-index,,,LGPL-2.1-or-later,
530,libpcap,Conan,C/C++,libpcap is an API for capturing network traffic,https://github.com/conan-io/conan-center-index,,,BSD-3-Clause,
531,libpng,Conan,C/C++,libpng is the official PNG file format reference library.,https://github.com/conan-io/conan-center-index,,,libpng-2.0,
532,libpq,Conan,C/C++,The library used by all the standard PostgreSQL tools.,https://github.com/conan-io/conan-center-index,,,PostgreSQL,
533,libpqxx,Conan,C/C++,The official C++ client API for PostgreSQL,https://github.com/conan-io/conan-center-index,,,BSD-3-Clause,
534,libproperties,Conan,C/C++,libproperties is a library to parse the Java .properties files. It was writen in pure C. And fully compatible with the Java .properties file format.,https://github.com/conan-io/conan-center-index,,,Apache-2.0,
535,libpsl,Conan,C/C++,C library for the Public Suffix List,https://github.com/conan-io/conan-center-index,,,GPL-2.0-or-later,
536,libqrencode,Conan,C/C++,A fast and compact QR Code encoding library,https://github.com/conan-io/conan-center-index,,,LGPL-2.1-or-later,
537,librasterlite,Conan,C/C++,librasterlite is an open source library that stores and retrieves huge raster coverages using a SpatiaLite DBMS.,https://github.com/conan-io/conan-center-index,,,MPL-1.1,
538,librasterlite2,Conan,C/C++,librasterlite2 is an open source library that stores and retrieves huge raster coverages using a SpatiaLite DBMS.,https://github.com/conan-io/conan-center-index,,,MPL-1.1,
539,libraw,Conan,C/C++,"LibRaw is a library for reading RAW files obtained from digital photo cameras (CRW/CR2, NEF, RAF, DNG, and others).",https://github.com/conan-io/conan-center-index,,,CDDL-1.0/LGPL-2.1-only,
540,librdkafka,Conan,C/C++,Librdkafka is an Apache Kafka C/C++ library designed with message delivery reliability and high performance in mind.,https://github.com/conan-io/conan-center-index,,,BSD-2-Clause,
542,libressl,Conan,C/C++,"LibreSSL is a version of the TLS/crypto stack forked from OpenSSL in 2014, with goals of modernizing the codebase, improving security, and applying best practice development processes.",https://github.com/conan-io/conan-center-index,,,OpenSSL,
543,librhash,Conan,C/C++,Great utility for computing hash sums,https://github.com/conan-io/conan-center-index,,,MIT,
544,librttopo,Conan,C/C++,The RT Topology Library exposes an API to create and manage standard (ISO 13249 aka SQL/MM) topologies.,https://github.com/conan-io/conan-center-index,,,GPL-2.0-or-later,
545,libsafec,Conan,C/C++,"This library implements the secure C11 Annex K[^5] functions on top of most libc implementations, which are missing from them.",https://github.com/conan-io/conan-center-index,,,MIT,
546,libsamplerate,Conan,C/C++,libsamplerate (also known as Secret Rabbit Code) is a library for performing sample rate conversion of audio data.,https://github.com/conan-io/conan-center-index,,,BSD-2-Clause,
547,libsass,Conan,C/C++,A C/C++ implementation of a Sass compiler,https://github.com/conan-io/conan-center-index,,,MIT,
548,libsecret,Conan,C/C++,A library for storing and retrieving passwords and other secrets,https://github.com/conan-io/conan-center-index,,,LGPL-2.1-or-later,
549,libselinux,Conan,C/C++,Security-enhanced Linux is a patch of the Linux kernel and a number of utilities with enhanced security functionality designed to add mandatory access controls to Linux,https://github.com/conan-io/conan-center-index,,,Unlicense,
550,libsgp4,Conan,C/C++,C++11 library for SGP4 Simplified perturbations model.,https://github.com/conan-io/conan-center-index,,,Apache-2.0,
551,libsigcpp,Conan,C/C++,libsigc++ implements a typesafe callback system for standard C++.,https://github.com/conan-io/conan-center-index,,,LGPL-3.0,
552,libsmacker,Conan,C/C++,A C library for decoding .smk Smacker Video files,https://github.com/conan-io/conan-center-index,,,LGPL-2.1-or-later,
553,libsndfile,Conan,C/C++,Libsndfile is a library of C routines for reading and writing files containing sampled audio data.,https://github.com/conan-io/conan-center-index,,,LGPL-2.1,
554,libsodium,Conan,C/C++,A modern and easy-to-use crypto library.,https://github.com/conan-io/conan-center-index,,,ISC,
555,libsolace,Conan,C/C++,High performance components for mission critical applications,https://github.com/conan-io/conan-center-index,,,Apache-2.0,
556,libspatialindex,Conan,C/C++,"C++ implementation of R*-tree, an MVR-tree and a TPR-tree with C API.",https://github.com/conan-io/conan-center-index,,,MIT,
557,libspatialite,Conan,C/C++,SpatiaLite is an open source library intended to extend the SQLite core to support fully fledged Spatial SQL capabilities.,https://github.com/conan-io/conan-center-index,,,MPL-1.1,
558,libsquish,Conan,C/C++,The libSquish library compresses images with the DXT standard (also known as S3TC).,https://github.com/conan-io/conan-center-index,,,MIT,
559,libsrtp,Conan,C/C++,"This package provides an implementation of the Secure Real-time TransportProtocol (SRTP), the Universal Security Transform (UST), and a supportingcryptographic kernel.",https://github.com/conan-io/conan-center-index,,,BSD-3-Clause,
560,libssh2,Conan,C/C++,libssh2 is a client-side C library implementing the SSH2 protocol,https://github.com/conan-io/conan-center-index,,,BSD-3-Clause,
561,libstudxml,Conan,C/C++,"A streaming XML pull parser and streaming XML serializer implementation for modern, standard C++.",https://github.com/conan-io/conan-center-index,,,MIT,
562,libsvm,Conan,C/C++,"Libsvm is a simple, easy-to-use, and efficient software for SVM classification and regression",https://github.com/conan-io/conan-center-index,,,BSD-3-Clause,
563,libsystemd,Conan,C/C++,System and Service Manager API library,https://github.com/conan-io/conan-center-index,,,LGPL-2.1-or-later,
564,libtar,Conan,C/C++,libtar is a library for manipulating tar files from within C programs.,https://github.com/conan-io/conan-center-index,,,BSD-3-Clause,
565,libtasn1,Conan,C/C++,"Libtasn1 is the ASN.1 library used by GnuTLS, p11-kit and some other packages.",https://github.com/conan-io/conan-center-index,,,LGPL-2.1-or-later,
566,libtiff,Conan,C/C++,Library for Tag Image File Format (TIFF),https://github.com/conan-io/conan-center-index,,,MIT,
567,libtins,Conan,C/C++,"High-level, multiplatform C++ network packet sniffing and crafting library.",https://github.com/conan-io/conan-center-index,,,BSD-2-Clause,
568,libtommath,Conan,C/C++,LibTomMath is a free open source portable number theoretic multiple-precision integer library written entirely in C.,https://github.com/conan-io/conan-center-index,,,Unlicense,
569,libtool,Conan,C/C++,GNU libtool is a generic library support script. ,https://github.com/conan-io/conan-center-index,,,GPL-2.0-or-later,
570,libtorrent,Conan,C/C++,libtorrent is a feature complete C++ bittorrent implementation focusing on efficiency and scalability,https://github.com/conan-io/conan-center-index,,,BSD-3-clause,
571,libucl,Conan,C/C++,Universal configuration library parser,https://github.com/conan-io/conan-center-index,,,BSD-2-Clause,
573,libui,Conan,C/C++,Simple and portable GUI library in C that uses the native GUI technologies of each platform it supports.,https://github.com/conan-io/conan-center-index,,,MIT,
574,libunistring,Conan,C/C++,This library provides functions for manipulating Unicode strings and for manipulating C strings according to the Unicode standard.,https://github.com/conan-io/conan-center-index,,,LGPL-3.0-or-later,
575,libunwind,Conan,C/C++,Manipulate the preserved state of each call-frame and resume the execution at any point.,https://github.com/conan-io/conan-center-index,,,MIT,
576,liburing,Conan,C/C++,"helpers to setup and teardown io_uring instances, and also a simplified interface for applications that don't need (or want) to deal with the full kernel side implementation.",https://github.com/conan-io/conan-center-index,,,GPL-2.0-or-later,
577,libusb,Conan,C/C++,A cross-platform library to access USB devices,https://github.com/conan-io/conan-center-index,,,LGPL-2.1,
578,libusb-compat,Conan,C/C++,A compatibility layer allowing applications written for libusb-0.1 to work with libusb-1.0,https://github.com/conan-io/conan-center-index,,,LGPL-2.1,
579,libuuid,Conan,C/C++,Portable uuid C library,https://github.com/conan-io/conan-center-index,,,BSD-3-Clause,
580,libuv,Conan,C/C++,A multi-platform support library with a focus on asynchronous I/O,https://github.com/conan-io/conan-center-index,,,MIT,
581,libuvc,Conan,C/C++,A cross-platform library for USB video devices,https://github.com/conan-io/conan-center-index,,,BSD-3-Clause,
582,libverto,Conan,C/C++,An async event loop abstraction library.,https://github.com/conan-io/conan-center-index,,,MIT,
583,libvpx,Conan,C/C++,WebM VP8/VP9 Codec SDK,https://github.com/conan-io/conan-center-index,,,BSD-3-Clause,
584,libwebp,Conan,C/C++,Library to encode and decode images in WebP format,https://github.com/conan-io/conan-center-index,,,BSD-3-Clause,
585,libwebsockets,Conan,C/C++,Canonical libwebsockets.org websocket library,https://github.com/conan-io/conan-center-index,,,MIT,
586,libx264,Conan,C/C++,x264 is a free software library and application for encoding video streams into the H.264/MPEG-4 AVC compression format,https://github.com/conan-io/conan-center-index,,,GPL-2.0,
587,libx265,Conan,C/C++,x265 is the leading H.265 / HEVC encoder software library,https://github.com/conan-io/conan-center-index,,,GPL-2.0-only,
588,libxcrypt,Conan,C/C++,"Extended crypt library for descrypt, md5crypt, bcrypt, and others",https://github.com/conan-io/conan-center-index,,,LGPL-2.1-or-later,
589,libxlsxwriter,Conan,C/C++,A C library for creating Excel XLSX files,https://github.com/conan-io/conan-center-index,,,BSD-2-Clause,
590,libxml2,Conan,C/C++,libxml2 is a software library for parsing XML documents,https://github.com/conan-io/conan-center-index,,,MIT,
592,libxslt,Conan,C/C++,"libxslt is a software library implementing XSLT processor, based on libxml2",https://github.com/conan-io/conan-center-index,,,MIT,
593,libyaml,Conan,C/C++,LibYAML is a YAML parser and emitter library.,https://github.com/conan-io/conan-center-index,,,MIT,
594,libyuv,Conan,C/C++,libyuv is an open source project that includes YUV scaling and conversion functionality.,https://github.com/conan-io/conan-center-index,,,BSD-3-Clause,
595,libzen,Conan,C/C++,Small C++ derivate classes to have an easier life,https://github.com/conan-io/conan-center-index,,,ZLIB,
596,libzip,Conan,C/C++,"A C library for reading, creating, and modifying zip archives",https://github.com/conan-io/conan-center-index,,,BSD-3-Clause,
597,libzippp,Conan,C/C++,A simple basic C++ wrapper around the libzip library,https://github.com/conan-io/conan-center-index,,,BSD-3-Clause,
598,lief,Conan,C/C++,Library to Instrument Executable Formats,https://github.com/conan-io/conan-center-index,,,Apache-2.0,
600,linux-headers-generic,Conan,C/C++,Generic Linux kernel headers,https://github.com/conan-io/conan-center-index,,,GPL-2.0-only,
601,linux-syscall-support,Conan,C/C++,Linux Syscall Support provides a header file that can be included into your application whenever you need to make direct system calls.,https://github.com/conan-io/conan-center-index,,,BSD-3-Clause,
602,liquid-dsp,Conan,C/C++,Digital signal processing library for software-defined radios (and more),https://github.com/conan-io/conan-center-index,,,MIT,
604,llvm-core,Conan,C/C++,"A toolkit for the construction of highly optimized compilers,optimizers, and runtime environments.",https://github.com/conan-io/conan-center-index,,,Apache-2.0 WITH LLVM-exception,
605,llvm-openmp,Conan,C/C++,"The OpenMP (Open Multi-Processing) specification is a standard for a set of compiler directives, library routines, and environment variables that can be used to specify shared memory parallelism in Fortran and C/C++ programs. This is the LLVM implementation.",https://github.com/conan-io/conan-center-index,,,Apache-2.0 WITH LLVM-exception,
606,lmdb,Conan,C/C++,Fast and compat memory-mapped key-value database,https://github.com/conan-io/conan-center-index,,,OLDAP-2.8,
607,lodepng,Conan,C/C++,"PNG encoder and decoder in C and C++, without dependencies.",https://github.com/conan-io/conan-center-index,,,Zlib,
608,log.c,Conan,C/C++,A simple logging library implemented in C99,https://github.com/conan-io/conan-center-index,,,MIT,
609,log4cplus,Conan,C/C++,"simple to use C++ logging API, modelled after the Java log4j API",https://github.com/conan-io/conan-center-index,,,"BSD-2-Clause, Apache-2.0",
610,log4cxx,Conan,C/C++,Logging framework for C++ patterned after Apache log4j,https://github.com/conan-io/conan-center-index,,,Apache-2.0,
611,logr,Conan,C/C++,"Logger frontend substitution for spdlog, glog, etc for server/desktop applications",https://github.com/conan-io/conan-center-index,,,BSD 3-Clause License,
612,lua,Conan,C/C++,"Lua is a powerful, efficient, lightweight, embeddable scripting language.",https://github.com/conan-io/conan-center-index,,,MIT,
613,luajit,Conan,C/C++,LuaJIT is a Just-In-Time Compiler (JIT) for the Lua programming language.,https://github.com/conan-io/conan-center-index,,,MIT,
614,luple,Conan,C/C++,"Home to luple, nuple, C++ String Interning, Struct Reader and C++ Type Loophole",https://github.com/conan-io/conan-center-index,,,Unlicense,
615,lyra,Conan,C/C++,"A simple to use, composing, header only, command line arguments parser for C++ 11 and beyond.",https://github.com/conan-io/conan-center-index,,,MIT,
616,lz4,Conan,C/C++,Extremely Fast Compression algorithm,https://github.com/conan-io/conan-center-index,,,BSD-2-Clause,
617,lzfse,Conan,C/C++,Lempel-Ziv style data compression algorithm using Finite State Entropy coding.,https://github.com/conan-io/conan-center-index,,,BSD-3-Clause,
618,lzip,Conan,C/C++,Lzip is a lossless data compressor with a user interface similar to the one of gzip or bzip2,https://github.com/conan-io/conan-center-index,,,GPL-v2-or-later,
619,lzma_sdk,Conan,C/C++,"LZMA provides a high compression ratio and fast decompression, so it is very suitable for embedded applications.",https://github.com/conan-io/conan-center-index,,,LZMA-exception,
620,lzo,Conan,C/C++,lzo is a portable lossless data compression library written in ANSI C,https://github.com/conan-io/conan-center-index,,,GPL-v2.0,
621,m4,Conan,C/C++,GNU M4 is an implementation of the traditional Unix macro processor,https://github.com/conan-io/conan-center-index,,,GPL-3.0-only,
622,magic_enum,Conan,C/C++,"Header-only C++17 library provides static reflection for enums, work with any enum type without any macro or boilerplate code.",https://github.com/conan-io/conan-center-index ,,,MIT,
623,magnum,Conan,C/C++,Lightweight and modular C++11/C++14 graphics middleware for games and data visualization,https://github.com/conan-io/conan-center-index,,,MIT,
625,magnum-integration,Conan,C/C++,Integration libraries for the Magnum C++11/C++14 graphics engine,https://github.com/conan-io/conan-center-index,,,MIT,
626,magnum-plugins,Conan,C/C++,Plugins for the Magnum C++11/C++14 graphics engine,https://github.com/conan-io/conan-center-index,,,MIT,
627,mailio,Conan,C/C++,"mailio is a cross platform C++ library for MIME format and SMTP, POP3 and IMAP protocols.",https://github.com/conan-io/conan-center-index,,,BSD-2-Clause,
628,make,Conan,C/C++,GNU Make is a tool which controls the generation of executables and other non-source files of a program from the program's source files,https://github.com/conan-io/conan-center-index,,,GPL-3.0-or-later,
629,makefile-project-workspace-creator,Conan,C/C++,"The Makefile, Project and Workspace Creator",https://github.com/conan-io/conan-center-index,,,BSD-3-Clause,
630,mariadb-connector-c,Conan,C/C++,MariaDB Connector/C is used to connect applications developed in C/C++ to MariaDB and MySQL databases.,https://github.com/conan-io/conan-center-index,,,LGPL-2.1-or-later,
631,mathfu,Conan,C/C++,C++ math library developed primarily for games focused on simplicity and efficiency.,https://github.com/conan-io/conan-center-index,,,Apache-2.0,
632,mathter,Conan,C/C++,Powerful 3D math and small-matrix linear algebra library for games and science.,https://github.com/conan-io/conan-center-index/,,,MIT,
633,matio,Conan,C/C++,Matio is a C library for reading and writing binary MATLAB MAT files.,https://github.com/conan-io/conan-center-index,,,BSD-2-Clause,
634,mattiasgustavsson-libs,Conan,C/C++,Single-file public domain libraries for C/C++,https://github.com/conan-io/conan-center-index,,,Unlicense,
635,mbedtls,Conan,C/C++,mbed TLS makes it trivially easy for developers to include cryptographic and SSL/TLS capabilities in their (embedded) products,https://github.com/conan-io/conan-center-index,,,Apache-2.0,
636,mbits-args,Conan,C/C++,"Small open-source library for program argument parser, inspired by Python's `argparse`, depending only on the standard library, with C++17 as minimum requirement.",https://github.com/conan-io/conan-center-index,,,MIT,
637,mdns,Conan,C/C++,Public domain mDNS/DNS-SD library in C,https://github.com/conan-io/conan-center-index,,,Unlicense,
638,mdnsresponder,Conan,C/C++,Conan package for Apple's mDNSResponder,https://github.com/conan-io/conan-center-index,,,Apache-2.0,
639,mdspan,Conan,C/C++,Production-quality reference implementation of mdspan,https://github.com/conan-io/conan-center-index,,,BSD-3-Clause,
640,meshoptimizer,Conan,C/C++," Mesh optimization library that makes meshes smaller and faster to render",https://github.com/conan-io/conan-center-index,,,MIT,
641,meson,Conan,C/C++,Meson is a project to create the best possible next-generation build system,https://github.com/conan-io/conan-center-index,,,Apache-2.0,
642,mfast,Conan,C/C++,mFAST is a high performance C++ encoding/decoding library for FAST (FIX Adapted for STreaming) protocol,https://github.com/conan-io/conan-center-index,,,LGPL-3.0,
643,mgs,Conan,C/C++,C++14 codec library,https://github.com/conan-io/conan-center-index,,,MIT,
644,microprofile,Conan,C/C++,"Microprofile is a embeddable profiler in a few files, written in C++",https://github.com/conan-io/conan-center-index,,,Unlicense,
645,microtar,Conan,C/C++,A lightweight tar library written in ANSI C,https://github.com/conan-io/conan-center-index,,,MIT,
646,mikktspace,Conan,C/C++," A common standard for tangent space used in baking tools to produce normal maps.",https://github.com/conan-io/conan-center-index,,,Zlib,
647,mimalloc,Conan,C/C++,mimalloc is a compact general purpose allocator with excellent performance.,https://github.com/conan-io/conan-center-index,,,MIT,
648,mingw-w64,Conan,C/C++,MinGW is a contraction of Minimalist GNU for Windows,https://github.com/conan-io/conan-center-index,,,ZPL-2.1,
649,miniaudio,Conan,C/C++,A single file audio playback and capture library.,https://github.com/conan-io/conan-center-index,,,Unlicense,
650,minimp3,Conan,C/C++,Minimalistic MP3 decoder single header library.,https://github.com/conan-io/conan-center-index,,,CC0-1.0,
651,miniupnpc,Conan,C/C++,UPnP client library/tool to access Internet Gateway Devices.,https://github.com/conan-io/conan-center-index,,,BSD-3-Clause,
652,miniz,Conan,C/C++,"Lossless, high performance data compression library that implements the zlib (RFC 1950) and Deflate (RFC 1951) compressed data format specification standards",https://github.com/conan-io/conan-center-index,,,MIT,
